{"$schema":"https://json-schema.org/draft/2020-12/schema","$id":"https://github.com/newcovid/nonebot-plugin-yijing/data/schemas/trigrams.schema.json","title":"trigrams","description":"Eight trigram metadata.","type":"array","items":{"type":"object","additionalProperties":true,"required":["name","symbol","bits","nature","direction","element","virtue","image"],"properties":{"name":{"type":"string"},"symbol":{"type":"string"},"bits":{"type":"array","minItems":3,"maxItems":3,"items":{"type":"integer","enum":[0,1]}},"nature":{"type":"string"},"direction":{"type":"string"},"element":{"type":"string"},"virtue":{"type":"string"},"image":{"type":"string"}}}}
